{
  "protocol_version": "v1",
  "kind": "event",
  "session_id": "sess_001",
  "turn_id": "turn_001",
  "event_type": "approval_requested",
  "payload": {
    "request_id": "appr_001",
    "target": "ps -eo pid,%cpu,cmd --sort=-%cpu | head -n 2",
    "reason": "command requires approval",
    "tool_name": "shell",
    "command_preview": "ps -eo pid,%cpu,cmd --sort=-%cpu | head -n 2",
    "risk_tags": [
      "write"
    ],
    "sandbox_backend": "linux_native",
    "degrade_reason": null
  }
}
